transaction_id,branch,client_id,client_type,transaction_date,amount,currency,narrative,clean_narrative
TXN001565,Kisumu,CL861,SME,2022-08-18,490446.1225297855,KES,"490,446. KES amount Approx verified. ID Nakuru; at processed utilities for Transaction #0f2662",kes amount approx verified id nakuru at processed utilities for transaction f
TXN002307,Nairobi_Main,CL647,SME,2024-04-20,1681375.9653462106,KES,recommended. STR KYC; valid no activity; outgoing Unusual #e9efaa,recommended str kyc valid no activity outgoing unusual e efaa
TXN004265,Mombasa,CL384,Retail,2024-06-06,3091615.0551579213,KES,"Large foreign remittance to UK; structuring suspected; escalate to compliance team. Approx amount KES 3,091,615. #7d0ec2",large foreign remittance to uk structuring suspected escalate to compliance team approx amount kes d ec
TXN002423,Eldoret,CL935,Corporate,2024-04-09,579294.4260286218,KES,"579,294. KES amount Approx verified. ID Nakuru; at processed salary for Transaction #a6191f",kes amount approx verified id nakuru at processed salary for transaction a f
TXN004741,Westlands,CL913,Corporate,2024-11-12,844976.009421659,KES,"Customer activity aligned with historical patterns; statements reviewed. Approx amount KES 844,976. #28db82",customer activity aligned with historical patterns statements reviewed approx amount kes db
TXN002399,Mombasa,CL111,SME,2023-02-09,626899.1967305472,KES,reviewed. statements Thika; at processed salary for Transaction #1e1d5a,reviewed statements thika at processed salary for transaction e d a
TXN002323,Eldoret,CL379,SME,2024-12-13,8948918.00827547,KES,Irregular pattern detected; structuring suspected; escalate to compliance team. #6c6a8b,irregular pattern detected structuring suspected escalate to compliance team c a b
TXN001943,Mombasa,CL242,SME,2024-07-13,1455888.539187081,KES,Unusual outgoing activity; structuring suspected; STR recommended. #8d8562,unusual outgoing activity structuring suspected str recommended d
TXN004735,Nairobi_Main,CL306,Corporate,2023-01-22,1167631.3199049234,KES,"1,167,631. KES amount Approx checked. invoice Nakuru; at rent for payment Routine #4e3ef0",kes amount approx checked invoice nakuru at rent for payment routine e ef
TXN003007,Westlands,CL988,SME,2024-02-28,202174.65019289663,KES,Processed salary or bill payment at Mombasa; ID verified. #48fe60,processed salary or bill payment at mombasa id verified fe
TXN000346,Kisumu,CL827,SME,2024-03-20,216715.55385989285,KES,Routine payment for utilities at Thika; statements reviewed. #8b6794,routine payment for utilities at thika statements reviewed b
TXN000775,Mombasa,CL988,Corporate,2024-11-17,198956.74058427408,KES,"Routine payment for rent at Nakuru; statements reviewed. Approx amount KES 198,957. #a275cb",routine payment for rent at nakuru statements reviewed approx amount kes a cb
TXN002559,Eldoret,CL862,SME,2022-07-09,1140513.431713266,KES,Routine payment for loan repayment at Mombasa; statements reviewed. #652ede,routine payment for loan repayment at mombasa statements reviewed ede
TXN001830,Nairobi_Main,CL197,SME,2024-05-17,3750474.7162360186,KES,Irregular pattern detected; third-party deposits observed; STR recommended. #ff5cd1,irregular pattern detected third party deposits observed str recommended ff cd
TXN004696,Eldoret,CL763,Retail,2024-01-16,3138142.8128406126,KES,recommended. STR observed; deposits third-party activity; outgoing Unusual #65cde0,recommended str observed deposits third party activity outgoing unusual cde
TXN004968,Eldoret,CL422,Retail,2023-08-18,485959.69613887934,KES,Routine payment for rent at Kisumu; statements reviewed. #15c219,routine payment for rent at kisumu statements reviewed c
TXN001717,Nairobi_Main,CL834,SME,2023-10-16,2353583.7201388483,KES,High-value tranfer to Cyprus; no valid KYC; escalate to compliance team. #d277d6,high value tranfer to cyprus no valid kyc escalate to compliance team d d
TXN004409,Kisumu,CL466,Retail,2022-12-10,1102750.8811711308,KES,"1,102,751. KES amount Approx checked. invoice Nakuru; at processed salary for Transaction #7432f6",kes amount approx checked invoice nakuru at processed salary for transaction f
TXN000838,Nairobi_Main,CL235,Corporate,2024-12-20,4808473.146979089,KES,"Unusual outgoing activity; third-party deposits observed; escalate to compliance team. Approx amount KES 4,808,473. #f750b2",unusual outgoing activity third party deposits observed escalate to compliance team approx amount kes f b
TXN004421,Westlands,CL985,SME,2024-12-31,746052.2195208186,KES,Unusual outgoing activity; profile inconsistent with transactions; escalate to compliance team. #720692,unusual outgoing activity profile inconsistent with transactions escalate to compliance team
TXN003733,Eldoret,CL145,Corporate,2022-02-18,661023.4681228445,KES,"Routine payment for loan repayment at Mombasa; ID verified. Approx amount KES 661,023. #c283d6",routine payment for loan repayment at mombasa id verified approx amount kes c d
TXN001757,Nairobi_Main,CL286,Corporate,2024-07-11,4674286.517511007,KES,High-value transfer to UK; no valid KYC; EDD triggered. #2d4f8c,high value transfer to uk no valid kyc edd triggered d f c
TXN000230,Mombasa,CL799,SME,2022-12-20,358162.96016278444,KES,"Routine payment for salary at Nairobi; invoice checked. Approx amount KES 358,163. #dfa79f",routine payment for salary at nairobi invoice checked approx amount kes dfa f
TXN000146,Eldoret,CL261,SME,2024-09-01,651312.1896333471,KES,"Irregular pattern detected; structuring suspected; STR recommended. Approx amount KES 651,312. #12821b",irregular pattern detected structuring suspected str recommended approx amount kes b
TXN000800,Eldoret,CL305,SME,2024-09-10,1151756.4283781536,KES,"1,151,756. KES amount Approx reviewed. statements Mombasa; at processed utilities for Transaction #bfb532",kes amount approx reviewed statements mombasa at processed utilities for transaction bfb
TXN004888,Mombasa,CL869,SME,2024-08-06,700288.1085649532,KES,"Processed salary or bill payment at Nairobi; statements reviewed. Approx amount KES 700,288. #0359cf",processed salary or bill payment at nairobi statements reviewed approx amount kes cf
TXN001867,Nairobi_Main,CL885,Retail,2023-07-15,1314140.7602657657,KES,"Transaction for loan repayment processed at Kisumu; statements reviewed. Approx amount KES 1,314,141. #497140",transaction for loan repayment processed at kisumu statements reviewed approx amount kes
TXN004180,Kisumu,CL778,Corporate,2023-04-21,725665.2100393843,KES,verified. ID Kisumu; at processed utilities for Transaction #0616f2,verified id kisumu at processed utilities for transaction f
TXN001971,Nairobi_Main,CL274,Corporate,2023-10-10,76246.58874779083,KES,Customer activity aligned with historical patterns; statements reviewed. #8a9a1c,customer activity aligned with historical patterns statements reviewed a a c
TXN004357,Eldoret,CL955,Retail,2024-08-11,1481163.732210864,KES,Unusual outgoing activity; structuring suspected; escalate to compliance team. #546331,unusual outgoing activity structuring suspected escalate to compliance team
TXN002116,Eldoret,CL499,Corporate,2023-04-01,508886.38542014686,KES,Processed salary or bill payment at Nairobi; invoice checked. #02bcc0,processed salary or bill payment at nairobi invoice checked bcc
TXN002910,Eldoret,CL738,Corporate,2024-12-29,410555.1056117208,KES,Customer activity aligned with historical patterns; statements reviewed. #22ce65,customer activity aligned with historical patterns statements reviewed ce
TXN003940,Nairobi_Main,CL241,Corporate,2023-03-29,778720.2788137428,KES,Processed salary or bill payment at Thika; statements reviewed. #e3b825,processed salary or bill payment at thika statements reviewed e b
TXN003514,Eldoret,CL433,Retail,2022-12-01,2932286.517640382,KES,Irregular pattern detected; structuring suspected; STR recommended. #ead55d,irregular pattern detected structuring suspected str recommended ead d
TXN001810,Kisumu,CL813,Corporate,2024-07-26,425856.3082702427,KES,Routine payment for utilities at Nairobi; invoice checked. #bc699d,routine payment for utilities at nairobi invoice checked bc d
TXN003115,Mombasa,CL652,Corporate,2023-06-23,712141.2291402818,KES,Transaction for school fees processed at Kisumu; statements reviewed. #3c06c0,transaction for school fees processed at kisumu statements reviewed c c
TXN002050,Nairobi_Main,CL300,Corporate,2022-05-14,1064024.2981896098,KES,Transaction for loan repayment processed at Mombasa; invoice checked. #dc9ed8,transaction for loan repayment processed at mombasa invoice checked dc ed
TXN000594,Kisumu,CL418,Retail,2022-07-18,5044383.226228868,KES,"High-value transfer to China; no valid KYC; escalate to compliance team. Approx amount KES 5,044,383. #878f6d",high value transfer to china no valid kyc escalate to compliance team approx amount kes f d
TXN002908,Mombasa,CL285,Retail,2024-04-20,435822.7920252804,KES,Processed salary or bill payment at Nairobi; statements reviewed. #1682f2,processed salary or bill payment at nairobi statements reviewed f
TXN003669,Westlands,CL642,Retail,2024-01-16,756971.6812547811,KES,verified. ID Nairobi; at processed salary for Transaction #72c4dc,verified id nairobi at processed salary for transaction c dc
TXN004326,Mombasa,CL313,SME,2022-10-06,393613.8160791541,KES,reviewed. statements patterns; historical with aligned activity Customer #59010b,reviewed statements patterns historical with aligned activity customer b
TXN002288,Kisumu,CL240,Corporate,2023-07-09,393069.9495601074,KES,"Customer activity aligned with historical patterns; statements reviewed. Approx amount KES 393,070. #af937b",customer activity aligned with historical patterns statements reviewed approx amount kes af b
TXN002843,Nairobi_Main,CL304,Corporate,2024-06-27,263696.5565675134,KES,Customer activity aligned with historical patterns; statements reviewed. #8bc250,customer activity aligned with historical patterns statements reviewed bc
TXN000097,Kisumu,CL326,SME,2022-12-11,716933.7314295853,KES,"Routine payment for salary at Nakuru; ID verified. Approx amount KES 716,934. #a6cdf1",routine payment for salary at nakuru id verified approx amount kes a cdf
TXN001963,Mombasa,CL404,SME,2022-04-05,938136.6598359336,KES,Routine payment for loan repayment at Kisumu; ID verified. #186a03,routine payment for loan repayment at kisumu id verified a
TXN000041,Kisumu,CL879,SME,2023-07-24,673307.7580090209,KES,verified. ID Nakuru; at processed salary for Transaction #c79abb,verified id nakuru at processed salary for transaction c abb
TXN000522,Mombasa,CL361,SME,2022-07-04,1092127.9698723466,KES,"Unusual outgoing activity; profile inconsistent with transactions; escalate to compliance team. Approx amount KES 1,092,128. #3a7d67",unusual outgoing activity profile inconsistent with transactions escalate to compliance team approx amount kes a d
TXN000564,Westlands,CL408,Retail,2022-03-17,1384500.1715694778,KES,Customer activity aligned with historical patterns; statements reviewed. #70a195,customer activity aligned with historical patterns statements reviewed a
TXN003758,Nairobi_Main,CL720,Retail,2023-02-24,2544952.683294548,KES,"2,544,953. KES amount Approx recommended. STR observed; deposits third-party Cyprus; to tranfer High-value #96d944",kes amount approx recommended str observed deposits third party cyprus to tranfer high value d
TXN002132,Kisumu,CL396,Corporate,2023-12-21,956468.2421583816,KES,"Processed salary or bill payment at Nairobi; ID verified. Approx amount KES 956,468. #95cfdd",processed salary or bill payment at nairobi id verified approx amount kes cfdd
TXN004520,Eldoret,CL405,Retail,2022-03-13,424474.0868498457,KES,"Transaction for rent processed at Kisumu; statements reviewed. Approx amount KES 424,474. #6f422d",transaction for rent processed at kisumu statements reviewed approx amount kes f d
TXN002593,Westlands,CL684,Corporate,2023-07-08,2089051.0156508328,KES,"Large foreign remittance to China; structuring suspected; STR recommended. Approx amount KES 2,089,051. #d85e74",large foreign remittance to china structuring suspected str recommended approx amount kes d e
TXN004307,Nairobi_Main,CL433,Retail,2022-01-05,996863.223787348,KES,Processed salary or bill payment at Nakuru; ID verified. #268b5f,processed salary or bill payment at nakuru id verified b f
TXN001786,Westlands,CL329,SME,2024-11-13,480966.8587878104,KES,"Transaction for utilities processed at Thika; ID verified. Approx amount KES 480,967. #e10288",transaction for utilities processed at thika id verified approx amount kes e
TXN004527,Eldoret,CL720,Corporate,2023-08-15,3943086.366881346,KES,Large foreign remittance to China; no valid KYC; EDD triggered. #a98686,large foreign remittance to china no valid kyc edd triggered a
TXN002937,Nairobi_Main,CL431,Corporate,2022-01-25,508548.5370024205,KES,"Transaction for school fees processed at Nakuru; statements reviewed. Approx amount KES 508,549. #3856cf",transaction for school fees processed at nakuru statements reviewed approx amount kes cf
TXN004946,Eldoret,CL198,Corporate,2023-09-05,355812.8556438398,KES,"Transaction for school fees processed at Mombasa; invoice checked. Approx amount KES 355,813. #4297b0",transaction for school fees processed at mombasa invoice checked approx amount kes b
TXN000547,Nairobi_Main,CL504,Retail,2022-01-28,518071.33792945946,KES,Customer activity aligned with historical patterns; ID verified. #1b0c5a,customer activity aligned with historical patterns id verified b c a
TXN000613,Kisumu,CL962,Corporate,2024-11-16,271619.55379201536,KES,"Processed salary or bill payment at Kisumu; invoice checked. Approx amount KES 271,620. #eea119",processed salary or bill payment at kisumu invoice checked approx amount kes eea
TXN004845,Kisumu,CL677,Retail,2024-03-27,3197494.510960532,KES,High-value transfer to Mauritius; profile inconsistent with transactions; escalate to compliance team. #2e20d7,high value transfer to mauritius profile inconsistent with transactions escalate to compliance team e d
TXN001733,Kisumu,CL330,Corporate,2022-07-05,1509272.335239798,KES,"Large foreign remittance to UK; structuring suspected; STR recommended. Approx amount KES 1,509,272. #c2f1ae",large foreign remittance to uk structuring suspected str recommended approx amount kes c f ae
TXN000633,Mombasa,CL325,Retail,2023-07-25,442937.18794364046,KES,"442,937. KES amount Approx verified. ID Mombasa; at processed fees school for Transaction #b64050",kes amount approx verified id mombasa at processed fees school for transaction b
TXN000935,Nairobi_Main,CL881,Retail,2023-03-13,1261927.9115701944,KES,Unusual outgoing activity; profile inconsistent with transactions; STR recommended. #7d8da6,unusual outgoing activity profile inconsistent with transactions str recommended d da
TXN001281,Kisumu,CL769,Corporate,2024-11-13,1728521.7946447236,KES,Irregular pattern detected; structuring suspected; escalate to compliance team. #0b1f38,irregular pattern detected structuring suspected escalate to compliance team b f
TXN004600,Nairobi_Main,CL845,SME,2022-10-21,513408.773226488,KES,Routine payment for utilities at Thika; statements reviewed. #ef0dbb,routine payment for utilities at thika statements reviewed ef dbb
TXN002850,Eldoret,CL751,Retail,2023-07-20,1210516.9824744167,KES,"Unusual outgoing activity; structuring suspected; escalate to compliance team. Approx amount KES 1,210,517. #6a3262",unusual outgoing activity structuring suspected escalate to compliance team approx amount kes a
TXN002212,Kisumu,CL516,Retail,2022-12-06,1107519.2293848298,KES,reviewed. statements Nairobi; at payment bill or salary Processed #98f6be,reviewed statements nairobi at payment bill or salary processed f be
TXN002225,Kisumu,CL229,Corporate,2022-04-23,6512107.073666635,KES,Irregular pattern detected; no valid KYC; escalate to compliance team. #c41b27,irregular pattern detected no valid kyc escalate to compliance team c b
TXN003148,Nairobi_Main,CL769,Retail,2022-02-26,552679.8844010563,KES,Customer activity aligned with historical patterns; statements reviewed. #8d8424,customer activity aligned with historical patterns statements reviewed d
TXN000464,Eldoret,CL327,Corporate,2022-11-02,1792110.8973394225,KES,"Unusual outgoing activity; third-party deposits observed; EDD triggered. Approx amount KES 1,792,111. #db3471",unusual outgoing activity third party deposits observed edd triggered approx amount kes db
TXN001247,Eldoret,CL604,SME,2022-11-04,991549.4424845563,KES,recommended. STR observed; deposits third-party activity; outgoing Unusual #1c1819,recommended str observed deposits third party activity outgoing unusual c
TXN004206,Kisumu,CL719,Retail,2022-02-22,3093016.9354918497,KES,Unusual outgoing activity; no valid KYC; STR recommended. #d7abdb,unusual outgoing activity no valid kyc str recommended d abdb
TXN001011,Nairobi_Main,CL682,Retail,2022-11-09,685785.1898108382,KES,Customer activity aligned with historical patterns; ID verified. #20be3a,customer activity aligned with historical patterns id verified be a
TXN003022,Mombasa,CL191,Retail,2023-08-06,447754.94994652405,KES,Transaction for loan repayment processed at Nairobi; invoice checked. #7797b6,transaction for loan repayment processed at nairobi invoice checked b
TXN002390,Eldoret,CL340,SME,2024-10-30,164007.67367835096,KES,"Processed salary or bill payment at Thika; ID verified. Approx amount KES 164,008. #2818b3",processed salary or bill payment at thika id verified approx amount kes b
TXN004681,Nairobi_Main,CL909,SME,2022-10-25,398916.05950757046,KES,"Routine payment for loan repayment at Nairobi; invoice checked. Approx amount KES 398,916. #9070ce",routine payment for loan repayment at nairobi invoice checked approx amount kes ce
TXN002630,Westlands,CL569,Corporate,2023-07-26,2589351.4337208485,KES,"2,589,351. KES amount Approx recommended. STR observed; deposits third-party Cyprus; to remittance foreign Large #d9f33a",kes amount approx recommended str observed deposits third party cyprus to remittance foreign large d f a
TXN002134,Mombasa,CL488,Corporate,2023-01-08,466107.466972699,KES,Transaction for loan repayment processed at Thika; invoice checked. #d4d818,transaction for loan repayment processed at thika invoice checked d d
TXN002925,Westlands,CL195,Retail,2022-11-13,2488066.2412514896,KES,triggered. EDD suspected; structuring Dubai; to remittance foreign Large #85b41a,triggered edd suspected structuring dubai to remittance foreign large b a
TXN003483,Eldoret,CL738,Retail,2024-11-30,570958.0892586523,KES,Transaction for utilities processed at Nakuru; statements reviewed. #253702,transaction for utilities processed at nakuru statements reviewed
TXN000977,Eldoret,CL531,SME,2022-03-23,223800.1188767677,KES,"High-value transfer to China; no valid KYC; escalate to compliance team. Approx amount KES 223,800. #138333",high value transfer to china no valid kyc escalate to compliance team approx amount kes
TXN003728,Mombasa,CL213,Corporate,2022-11-08,257870.22414010283,KES,reviewed. statements patterns; historical with aligned activity Customer #b11238,reviewed statements patterns historical with aligned activity customer b
TXN001036,Mombasa,CL289,Corporate,2022-01-13,657901.763321604,KES,Irregular pattern detected; third-party deposits observed; escalate to compliance team. #8dedac,irregular pattern detected third party deposits observed escalate to compliance team dedac
TXN000566,Nairobi_Main,CL874,Corporate,2022-09-13,316692.9331758863,KES,"316,693. KES amount Approx team. compliance to escalate observed; deposits third-party UK; to remittance foreign Large #08198b",kes amount approx team compliance to escalate observed deposits third party uk to remittance foreign large b
TXN002552,Mombasa,CL990,Corporate,2023-02-19,2212592.8537058355,KES,Transaction for rent processed at Nakuru; ID verified. #7cc7d8,transaction for rent processed at nakuru id verified cc d
TXN003098,Eldoret,CL252,Retail,2023-05-06,545434.4582616803,KES,reviewed. statements Mombasa; at payment bill or salary Processed #269e13,reviewed statements mombasa at payment bill or salary processed e
TXN004814,Kisumu,CL928,Retail,2022-12-13,740545.1859522254,KES,verified. ID Kisumu; at rent for payment Routine #8a9fb7,verified id kisumu at rent for payment routine a fb
TXN000978,Eldoret,CL285,Retail,2023-11-05,476626.0303227986,KES,Unusual outgoing activity; no valid KYC; EDD triggered. #e464f0,unusual outgoing activity no valid kyc edd triggered e f
TXN001287,Kisumu,CL458,Corporate,2024-02-19,852214.8359006849,KES,"Transaction for loan repayment processed at Kisumu; ID verified. Approx amount KES 852,215. #50581b",transaction for loan repayment processed at kisumu id verified approx amount kes b
TXN004864,Kisumu,CL725,SME,2024-10-25,566306.077801261,KES,Transaction for salary processed at Nairobi; statements reviewed. #83c0d2,transaction for salary processed at nairobi statements reviewed c d
TXN000103,Kisumu,CL167,SME,2022-07-13,340580.1995677704,KES,"Customer activity aligned with historical patterns; invoice checked. Approx amount KES 340,580. #ec8938",customer activity aligned with historical patterns invoice checked approx amount kes ec
TXN002100,Mombasa,CL571,Corporate,2023-07-07,2782244.6098190104,KES,High-value tranfer to Cyprus; profile inconsistent with transactions; escalate to compliance team. #dd36aa,high value tranfer to cyprus profile inconsistent with transactions escalate to compliance team dd aa
TXN000158,Nairobi_Main,CL405,SME,2024-05-18,259389.88388095703,KES,Customer activity aligned with historical patterns; ID verified. #34252a,customer activity aligned with historical patterns id verified a
TXN002424,Nairobi_Main,CL906,SME,2022-09-09,204479.85646320568,KES,Routine payment for loan repayment at Nakuru; statements reviewed. #a286f4,routine payment for loan repayment at nakuru statements reviewed a f
TXN000293,Westlands,CL373,Retail,2023-08-10,1082432.5938017955,KES,Processed salary or bill payment at Kisumu; invoice checked. #68efaa,processed salary or bill payment at kisumu invoice checked efaa
TXN004484,Westlands,CL223,Corporate,2024-07-26,583180.6860036264,KES,Processed salary or bill payment at Nairobi; ID verified. #559582,processed salary or bill payment at nairobi id verified
TXN003751,Westlands,CL789,Corporate,2023-11-05,751912.1280425297,KES,Routine payment for salary at Kisumu; statements reviewed. #ead893,routine payment for salary at kisumu statements reviewed ead
TXN000573,Nairobi_Main,CL527,SME,2023-09-27,512281.5369928077,KES,"Processed salary or bill payment at Kisumu; invoice checked. Approx amount KES 512,282. #546e63",processed salary or bill payment at kisumu invoice checked approx amount kes e
TXN001157,Mombasa,CL123,Retail,2023-08-07,2889820.8361092536,KES,Customer activity aligned with historical patterns; invoice checked. #466f85,customer activity aligned with historical patterns invoice checked f
TXN001060,Kisumu,CL300,SME,2023-06-18,3971001.308326069,KES,High-value transfer to UK; profile inconsistent with transactions; EDD triggered. #aeba3d,high value transfer to uk profile inconsistent with transactions edd triggered aeba d
TXN000783,Eldoret,CL796,SME,2023-04-13,915668.8141724904,KES,Transaction for loan repayment processed at Kisumu; invoice checked. #186722,transaction for loan repayment processed at kisumu invoice checked
TXN004719,Eldoret,CL379,Corporate,2024-08-15,645809.2178507935,KES,"Transaction for utilities processed at Mombasa; ID verified. Approx amount KES 645,809. #0dd4e3",transaction for utilities processed at mombasa id verified approx amount kes dd e
TXN003553,Eldoret,CL724,Retail,2024-06-20,3464537.091341775,KES,"3,464,537. KES amount Approx checked. invoice Mombasa; at salary for payment Routine #326f45",kes amount approx checked invoice mombasa at salary for payment routine f
TXN004426,Eldoret,CL232,Corporate,2022-11-13,763187.5998974801,KES,Customer activity aligned with historical patterns; statements reviewed. #f0e2c6,customer activity aligned with historical patterns statements reviewed f e c
TXN003767,Eldoret,CL596,Corporate,2022-03-25,6408636.801077433,KES,"Unusual outgoing activity; third-party deposits observed; STR recommended. Approx amount KES 6,408,637. #38eb1b",unusual outgoing activity third party deposits observed str recommended approx amount kes eb b
TXN004825,Kisumu,CL155,Retail,2023-07-10,707058.1382975377,KES,"Transaction for rent processed at Thika; invoice checked. Approx amount KES 707,058. #038bae",transaction for rent processed at thika invoice checked approx amount kes bae
TXN000673,Nairobi_Main,CL871,Retail,2022-08-29,460464.6621832135,KES,Transaction for utilities processed at Thika; statements reviewed. #d3e16e,transaction for utilities processed at thika statements reviewed d e e
TXN003017,Eldoret,CL504,SME,2023-11-20,82247.73097546073,KES,Routine payment for loan repayment at Mombasa; invoice checked. #4f3f19,routine payment for loan repayment at mombasa invoice checked f f
TXN003046,Eldoret,CL326,Retail,2023-02-13,1344256.7895512877,KES,Customer activity aligned with historical patterns; invoice checked. #66f667,customer activity aligned with historical patterns invoice checked f
TXN002190,Westlands,CL889,SME,2024-09-03,470564.3901179068,KES,"Irregular pattern detected; no valid KYC; STR recommended. Approx amount KES 470,564. #5413f5",irregular pattern detected no valid kyc str recommended approx amount kes f
TXN000049,Eldoret,CL477,SME,2024-12-23,173836.74510520624,KES,checked. invoice patterns; historical with aligned activity Customer #3024b4,checked invoice patterns historical with aligned activity customer b
TXN002075,Mombasa,CL383,Retail,2022-05-12,478661.5262253807,KES,Routine payment for rent at Kisumu; statements reviewed. #679728,routine payment for rent at kisumu statements reviewed
TXN004953,Eldoret,CL182,Corporate,2024-09-25,1177257.710920026,KES,Transaction for loan repayment processed at Kisumu; statements reviewed. #511ab6,transaction for loan repayment processed at kisumu statements reviewed ab
