transaction_id,branch,client_id,client_type,transaction_date,amount,currency,narrative,clean_narrative
TXN003231,Westlands,CL894,Corporate,2022-10-25,320223.0022827047,KES,Irregular pattern detected; structuring suspected; escalate to compliance team. #49fe25,irregular pattern detected structuring suspected escalate to compliance team fe
TXN002135,Mombasa,CL551,SME,2024-06-18,399703.6829617879,KES,"Processed salary or bill payment at Mombasa; statements reviewed. Approx amount KES 399,704. #5d65c4",processed salary or bill payment at mombasa statements reviewed approx amount kes d c
TXN000933,Kisumu,CL370,Corporate,2023-05-25,128134.50741877944,KES,checked. invoice Thika; at utilities for payment Routine #6af92d,checked invoice thika at utilities for payment routine af d
TXN004082,Mombasa,CL643,SME,2023-05-08,8982665.351970242,KES,Large foreign remittance to Hong Kong; structuring suspected; escalate to compliance team. #5a7a70,large foreign remittance to hong kong structuring suspected escalate to compliance team a a
TXN000923,Nairobi_Main,CL326,SME,2024-01-13,1055886.5107103942,KES,"Unusual outgoing activity; third-party deposits observed; escalate to compliance team. Approx amount KES 1,055,887. #a77ed8",unusual outgoing activity third party deposits observed escalate to compliance team approx amount kes a ed
TXN003647,Mombasa,CL696,SME,2022-03-23,693091.8735848004,KES,Transaction for utilities processed at Nakuru; statements reviewed. #263708,transaction for utilities processed at nakuru statements reviewed
TXN000544,Mombasa,CL402,Corporate,2022-04-08,214383.11488683688,KES,"Unusual outgoing activity; no valid KYC; EDD triggered. Approx amount KES 214,383. #402f87",unusual outgoing activity no valid kyc edd triggered approx amount kes f
TXN001777,Westlands,CL963,Corporate,2023-03-14,1917757.0972892367,KES,"Unusual outgoing activity; profile inconsistent with transactions; escalate to compliance team. Approx amount KES 1,917,757. #20c7b7",unusual outgoing activity profile inconsistent with transactions escalate to compliance team approx amount kes c b
TXN000550,Mombasa,CL596,SME,2022-02-10,634512.8710229736,KES,"Customer activity aligned with historical patterns; invoice checked. Approx amount KES 634,513. #78ce0f",customer activity aligned with historical patterns invoice checked approx amount kes ce f
TXN001806,Westlands,CL488,Retail,2022-05-17,719987.1587098911,KES,Routine payment for utilities at Kisumu; ID verified. #4263af,routine payment for utilities at kisumu id verified af
TXN003997,Mombasa,CL607,Retail,2022-04-03,477247.9932807702,KES,"Customer activity aligned with historical patterns; statements reviewed. Approx amount KES 477,248. #7bfbd0",customer activity aligned with historical patterns statements reviewed approx amount kes bfbd
TXN002916,Eldoret,CL591,Corporate,2023-02-04,528133.9576341795,KES,Routine payment for loan repayment at Nakuru; statements reviewed. #9799e4,routine payment for loan repayment at nakuru statements reviewed e
TXN003851,Kisumu,CL509,Corporate,2023-02-27,843705.174593746,KES,"Transaction for salary processed at Mombasa; statements reviewed. Approx amount KES 843,705. #b47cdd",transaction for salary processed at mombasa statements reviewed approx amount kes b cdd
TXN000102,Westlands,CL140,Retail,2024-06-15,1456514.681221537,KES,Unusual outgoing activity; structuring suspected; STR recommended. #5a5cda,unusual outgoing activity structuring suspected str recommended a cda
TXN003059,Eldoret,CL277,Corporate,2023-07-07,1388712.1424735629,KES,"High-value tranfer to China; third-party deposits observed; EDD triggered. Approx amount KES 1,388,712. #8c4481",high value tranfer to china third party deposits observed edd triggered approx amount kes c
TXN000301,Eldoret,CL184,Retail,2022-12-09,1197608.3254269788,KES,Large foreign remittance to Dubai; profile inconsistent with transactions; escalate to compliance team. #1678ba,large foreign remittance to dubai profile inconsistent with transactions escalate to compliance team ba
TXN001503,Westlands,CL818,SME,2024-02-11,595786.6307262954,KES,checked. invoice patterns; historical with aligned activity Customer #fa1f4c,checked invoice patterns historical with aligned activity customer fa f c
TXN002842,Westlands,CL663,Corporate,2022-07-25,7491210.69165591,KES,"Unusual outgoing activity; no valid KYC; EDD triggered. Approx amount KES 7,491,211. #488fa7",unusual outgoing activity no valid kyc edd triggered approx amount kes fa
TXN002035,Eldoret,CL253,Retail,2023-08-18,23764276.77051583,KES,High-value transfer to Dubai; no valid KYC; escalate to compliance team. #298afd,high value transfer to dubai no valid kyc escalate to compliance team afd
TXN002363,Nairobi_Main,CL133,SME,2023-04-28,1301309.8114851648,KES,"Customer activity aligned with historical patterns; ID verified. Approx amount KES 1,301,310. #7ad007",customer activity aligned with historical patterns id verified approx amount kes ad
TXN000829,Westlands,CL162,Corporate,2023-06-15,1538615.9738566943,KES,"High-value transfer to Hong Kong; no valid KYC; escalate to compliance team. Approx amount KES 1,538,616. #22c560",high value transfer to hong kong no valid kyc escalate to compliance team approx amount kes c
TXN004621,Kisumu,CL810,SME,2023-09-20,1999401.7763271828,KES,Customer activity aligned with historical patterns; ID verified. #7755ad,customer activity aligned with historical patterns id verified ad
TXN002596,Eldoret,CL175,Corporate,2022-10-28,390549.4191064576,KES,Routine payment for rent at Nakuru; statements reviewed. #7d39f4,routine payment for rent at nakuru statements reviewed d f
TXN001874,Westlands,CL316,SME,2023-04-08,6447982.644193526,KES,"6,447,983. KES amount Approx recommended. STR suspected; structuring Dubai; to remittance foreign Large #fd8c29",kes amount approx recommended str suspected structuring dubai to remittance foreign large fd c
TXN002455,Kisumu,CL219,Retail,2024-08-12,1691408.731714171,KES,"Customer activity aligned with historical patterns; statements reviewed. Approx amount KES 1,691,409. #d9c59a",customer activity aligned with historical patterns statements reviewed approx amount kes d c a
TXN000830,Nairobi_Main,CL342,Retail,2023-10-30,233021.1829295159,KES,"233,021. KES amount Approx reviewed. statements Thika; at processed rent for Transaction #8ec500",kes amount approx reviewed statements thika at processed rent for transaction ec
TXN000178,Eldoret,CL402,Retail,2022-05-31,496202.91096265934,KES,Processed salary or bill payment at Mombasa; invoice checked. #6ca225,processed salary or bill payment at mombasa invoice checked ca
TXN002441,Nairobi_Main,CL397,Corporate,2024-01-06,1570677.880383812,KES,"Routine payment for loan repayment at Nairobi; invoice checked. Approx amount KES 1,570,678. #09e9b4",routine payment for loan repayment at nairobi invoice checked approx amount kes e b
TXN002046,Eldoret,CL790,Retail,2022-01-18,597282.1808490576,KES,checked. invoice Kisumu; at payment bill or salary Processed #ebf9d6,checked invoice kisumu at payment bill or salary processed ebf d
TXN002377,Westlands,CL664,Retail,2022-11-29,601124.3411350214,KES,Unusual outgoing activity; profile inconsistent with transactions; escalate to compliance team. #e044a2,unusual outgoing activity profile inconsistent with transactions escalate to compliance team e a
TXN004706,Kisumu,CL269,SME,2022-01-18,1598944.564123684,KES,checked. invoice Nakuru; at utilities for payment Routine #41ccde,checked invoice nakuru at utilities for payment routine ccde
TXN001964,Mombasa,CL577,Retail,2022-05-11,881097.1103030033,KES,"881,097. KES amount Approx reviewed. statements patterns; historical with aligned activity Customer #38f774",kes amount approx reviewed statements patterns historical with aligned activity customer f
TXN001259,Eldoret,CL850,Retail,2024-09-05,574331.2765331325,KES,Customer activity aligned with historical patterns; statements reviewed. #2e5e54,customer activity aligned with historical patterns statements reviewed e e
TXN001980,Eldoret,CL612,SME,2022-10-17,826957.7950550765,KES,triggered. EDD suspected; structuring activity; outgoing Unusual #e97968,triggered edd suspected structuring activity outgoing unusual e
TXN004944,Westlands,CL615,SME,2024-03-06,9562151.980023663,KES,Large foreign remittance to China; profile inconsistent with transactions; STR recommended. #ec5809,large foreign remittance to china profile inconsistent with transactions str recommended ec
TXN004181,Kisumu,CL605,Retail,2022-09-05,1253823.1652206527,KES,Large foreign remittance to Dubai; profile inconsistent with transactions; EDD triggered. #7b133e,large foreign remittance to dubai profile inconsistent with transactions edd triggered b e
TXN004490,Eldoret,CL267,Corporate,2023-04-25,2830259.2886378462,KES,"Unusual outgoing activity; profile inconsistent with transactions; STR recommended. Approx amount KES 2,830,259. #6bd519",unusual outgoing activity profile inconsistent with transactions str recommended approx amount kes bd
TXN000577,Eldoret,CL554,Retail,2024-12-28,1024387.7097459832,KES,Transaction for salary processed at Thika; ID verified. #d9d63e,transaction for salary processed at thika id verified d d e
TXN000248,Eldoret,CL528,Corporate,2024-08-30,2055064.8615178133,KES,Transaction for salary processed at Kisumu; statements reviewed. #b2020b,transaction for salary processed at kisumu statements reviewed b b
TXN001155,Mombasa,CL606,Corporate,2023-11-29,1210896.996726379,KES,"1,210,897. KES amount Approx verified. ID Nakuru; at processed rent for Transaction #defd28",kes amount approx verified id nakuru at processed rent for transaction defd
TXN003660,Nairobi_Main,CL568,Retail,2024-02-10,464154.38950681576,KES,"Customer activity aligned with historical patterns; ID verified. Approx amount KES 464,154. #a469a6",customer activity aligned with historical patterns id verified approx amount kes a a
TXN000063,Mombasa,CL583,Retail,2024-07-24,675638.8983922515,KES,High-value transfer to Cyprus; no valid KYC; escalate to compliance team. #e77f60,high value transfer to cyprus no valid kyc escalate to compliance team e f
TXN000598,Nairobi_Main,CL564,Corporate,2023-11-04,1329264.136070578,KES,High-value transfer to Cyprus; third-party deposits observed; EDD triggered. #91ead0,high value transfer to cyprus third party deposits observed edd triggered ead
TXN002504,Kisumu,CL373,Retail,2023-10-09,279398.5766295352,KES,Routine payment for school fees at Nairobi; invoice checked. #e738f4,routine payment for school fees at nairobi invoice checked e f
TXN001807,Mombasa,CL971,SME,2022-07-09,852652.6351358597,KES,"Routine payment for utilities at Thika; statements reviewed. Approx amount KES 852,653. #60e5e8",routine payment for utilities at thika statements reviewed approx amount kes e e
TXN002964,Kisumu,CL745,Retail,2022-06-28,1405857.7138333707,KES,reviewed. statements Mombasa; at repayment loan for payment Routine #1fb425,reviewed statements mombasa at repayment loan for payment routine fb
TXN001286,Mombasa,CL740,Corporate,2022-10-15,165157.73052357024,KES,Routine payment for loan repayment at Nairobi; ID verified. #99349d,routine payment for loan repayment at nairobi id verified d
TXN004057,Westlands,CL292,SME,2024-11-17,817531.7632769664,KES,Customer activity aligned with historical patterns; invoice checked. #b8d404,customer activity aligned with historical patterns invoice checked b d
TXN000922,Westlands,CL875,SME,2023-12-03,2234823.2647579666,KES,"Irregular pattern detected; structuring suspected; EDD triggered. Approx amount KES 2,234,823. #b2adf8",irregular pattern detected structuring suspected edd triggered approx amount kes b adf
TXN001024,Kisumu,CL410,Retail,2022-11-24,2001245.3486550024,KES,Routine payment for salary at Kisumu; statements reviewed. #b54e29,routine payment for salary at kisumu statements reviewed b e
TXN001401,Westlands,CL848,Retail,2024-12-10,869485.4916376318,KES,reviewed. statements patterns; historical with aligned activity Customer #3b10dd,reviewed statements patterns historical with aligned activity customer b dd
TXN004251,Nairobi_Main,CL782,Retail,2024-09-11,2396695.8526210254,KES,Unusual outgoing activity; structuring suspected; escalate to compliance team. #6be2f9,unusual outgoing activity structuring suspected escalate to compliance team be f
TXN000789,Mombasa,CL395,Retail,2023-08-27,444691.0986789712,KES,High-value transfer to Cyprus; structuring suspected; EDD triggered. #e42e9d,high value transfer to cyprus structuring suspected edd triggered e e d
TXN004758,Eldoret,CL213,Retail,2024-10-29,374821.2000232742,KES,"Routine payment for school fees at Mombasa; ID verified. Approx amount KES 374,821. #3c045f",routine payment for school fees at mombasa id verified approx amount kes c f
TXN000395,Eldoret,CL155,Corporate,2024-11-24,430015.7193058084,KES,"Transaction for school fees processed at Kisumu; invoice checked. Approx amount KES 430,016. #f1a083",transaction for school fees processed at kisumu invoice checked approx amount kes f a
TXN001014,Mombasa,CL103,Corporate,2022-04-30,2013076.4100863729,KES,Transaction for loan repayment processed at Mombasa; statements reviewed. #6b8fd1,transaction for loan repayment processed at mombasa statements reviewed b fd
TXN001302,Eldoret,CL875,Corporate,2023-07-07,528357.3697118054,KES,Transaction for rent processed at Nairobi; ID verified. #efb6b2,transaction for rent processed at nairobi id verified efb b
TXN000501,Mombasa,CL464,SME,2024-04-08,11055902.17068192,KES,Unusual outgoing activity; structuring suspected; EDD triggered. #e9fcec,unusual outgoing activity structuring suspected edd triggered e fcec
TXN000257,Nairobi_Main,CL347,SME,2024-09-28,1048737.3565345104,KES,"Unusual outgoing activity; profile inconsistent with transactions; escalate to compliance team. Approx amount KES 1,048,737. #99dc4c",unusual outgoing activity profile inconsistent with transactions escalate to compliance team approx amount kes dc c
TXN000223,Kisumu,CL195,Retail,2023-04-20,193126.15171076343,KES,Routine payment for salary at Mombasa; statements reviewed. #88c56e,routine payment for salary at mombasa statements reviewed c e
TXN000900,Mombasa,CL545,Retail,2024-08-09,773028.5927486578,KES,Transaction for school fees processed at Nairobi; invoice checked. #74ab13,transaction for school fees processed at nairobi invoice checked ab
TXN000716,Westlands,CL282,SME,2024-12-22,2197442.8113656333,KES,"Large foreign remittance to Mauritius; no valid KYC; escalate to compliance team. Approx amount KES 2,197,443. #95893a",large foreign remittance to mauritius no valid kyc escalate to compliance team approx amount kes a
TXN004086,Kisumu,CL194,Corporate,2024-04-08,1090023.06075827,KES,checked. invoice Thika; at utilities for payment Routine #45c4b3,checked invoice thika at utilities for payment routine c b
TXN003198,Nairobi_Main,CL646,SME,2024-09-07,460181.6873312627,KES,Transaction for rent processed at Nairobi; statements reviewed. #ed4edd,transaction for rent processed at nairobi statements reviewed ed edd
TXN000509,Mombasa,CL702,Retail,2023-10-11,938600.1998163332,KES,High-value transfer to China; profile inconsistent with transactions; STR recommended. #0a19af,high value transfer to china profile inconsistent with transactions str recommended a af
TXN002633,Kisumu,CL197,Retail,2023-09-29,742602.4139625331,KES,Transaction for salary processed at Mombasa; invoice checked. #bc1cca,transaction for salary processed at mombasa invoice checked bc cca
TXN001424,Mombasa,CL298,Corporate,2022-12-02,287400.9517434068,KES,"Customer activity aligned with historical patterns; invoice checked. Approx amount KES 287,401. #b37d0b",customer activity aligned with historical patterns invoice checked approx amount kes b d b
TXN004854,Westlands,CL775,SME,2022-11-18,1365590.3739619085,KES,Customer activity aligned with historical patterns; statements reviewed. #95d142,customer activity aligned with historical patterns statements reviewed d
TXN001058,Kisumu,CL604,Retail,2024-04-29,3234031.758087028,KES,"Irregular pattern detected; structuring suspected; escalate to compliance team. Approx amount KES 3,234,032. #15b29c",irregular pattern detected structuring suspected escalate to compliance team approx amount kes b c
TXN004085,Nairobi_Main,CL438,Corporate,2022-03-04,510413.6326458391,KES,Processed salary or bill payment at Thika; statements reviewed. #acc950,processed salary or bill payment at thika statements reviewed acc
TXN003108,Westlands,CL321,Corporate,2022-03-10,818658.5696207732,KES,Routine payment for school fees at Nakuru; ID verified. #dab8af,routine payment for school fees at nakuru id verified dab af
TXN001162,Westlands,CL604,Corporate,2023-05-03,225776.1438121197,KES,verified. ID patterns; historical with aligned activity Customer #58040f,verified id patterns historical with aligned activity customer f
TXN004580,Mombasa,CL413,Corporate,2022-08-25,2394112.305612077,KES,Irregular pattern detected; no valid KYC; STR recommended. #1f542b,irregular pattern detected no valid kyc str recommended f b
TXN004461,Westlands,CL105,SME,2024-01-26,2179385.46660088,KES,Customer activity aligned with historical patterns; invoice checked. #6c6291,customer activity aligned with historical patterns invoice checked c
TXN004978,Westlands,CL749,Corporate,2023-02-01,784438.2746022837,KES,"Customer activity aligned with historical patterns; statements reviewed. Approx amount KES 784,438. #fd39a6",customer activity aligned with historical patterns statements reviewed approx amount kes fd a
TXN001912,Westlands,CL101,Corporate,2022-05-06,933443.5520698972,KES,"933,444. KES amount Approx checked. invoice Thika; at processed salary for Transaction #cb2247",kes amount approx checked invoice thika at processed salary for transaction cb
TXN000122,Nairobi_Main,CL687,Retail,2024-12-20,7007663.401538604,KES,"7,007,663. KES amount Approx team. compliance to escalate observed; deposits third-party Mauritius; to remittance foreign Large #bbe74c",kes amount approx team compliance to escalate observed deposits third party mauritius to remittance foreign large bbe c
TXN002720,Eldoret,CL344,SME,2022-11-18,11510171.6116638,KES,"Irregular pattern detected; no valid KYC; escalate to compliance team. Approx amount KES 11,510,172. #f24dad",irregular pattern detected no valid kyc escalate to compliance team approx amount kes f dad
TXN002616,Mombasa,CL936,Retail,2022-05-25,357209.72056963044,KES,Routine payment for school fees at Nairobi; ID verified. #e7b295,routine payment for school fees at nairobi id verified e b
TXN004127,Westlands,CL602,Retail,2023-07-30,2103488.074941453,KES,"Processed salary or bill payment at Nairobi; statements reviewed. Approx amount KES 2,103,488. #c931a4",processed salary or bill payment at nairobi statements reviewed approx amount kes c a
TXN004501,Nairobi_Main,CL129,Retail,2024-07-06,231710.47469194987,KES,Transaction for loan repayment processed at Thika; ID verified. #f6da2c,transaction for loan repayment processed at thika id verified f da c
TXN001659,Nairobi_Main,CL688,Retail,2023-05-19,1326315.0195145954,KES,checked. invoice patterns; historical with aligned activity Customer #1052ae,checked invoice patterns historical with aligned activity customer ae
TXN001710,Nairobi_Main,CL113,Retail,2024-10-13,1296211.6704218087,KES,Transaction for school fees processed at Kisumu; ID verified. #96f940,transaction for school fees processed at kisumu id verified f
TXN000637,Mombasa,CL856,SME,2022-10-02,2118007.127772622,KES,"2,118,007. KES amount Approx recommended. STR transactions; with inconsistent profile Cyprus; to remittance foreign Large #6a92dc",kes amount approx recommended str transactions with inconsistent profile cyprus to remittance foreign large a dc
TXN000252,Mombasa,CL370,SME,2024-09-21,13388953.741511408,KES,recommended. STR KYC; valid no detected; pattern Irregular #e5047d,recommended str kyc valid no detected pattern irregular e d
TXN004142,Westlands,CL211,SME,2022-06-09,779896.6801808119,KES,"Transaction for rent processed at Nairobi; ID verified. Approx amount KES 779,897. #20aa76",transaction for rent processed at nairobi id verified approx amount kes aa
TXN004851,Westlands,CL759,Corporate,2023-11-05,19660237.20252873,KES,Unusual outgoing activity; profile inconsistent with transactions; EDD triggered. #05c952,unusual outgoing activity profile inconsistent with transactions edd triggered c
TXN000385,Kisumu,CL740,SME,2023-04-29,663494.3720701998,KES,"Transaction for salary processed at Mombasa; statements reviewed. Approx amount KES 663,494. #c32467",transaction for salary processed at mombasa statements reviewed approx amount kes c
TXN003845,Nairobi_Main,CL388,Retail,2024-11-02,1066359.1952860611,KES,"Routine payment for school fees at Thika; ID verified. Approx amount KES 1,066,359. #81b4c1",routine payment for school fees at thika id verified approx amount kes b c
TXN004692,Kisumu,CL575,Retail,2022-04-04,1162303.5012920364,KES,Processed salary or bill payment at Thika; invoice checked. #894f21,processed salary or bill payment at thika invoice checked f
TXN002499,Eldoret,CL760,Corporate,2024-12-02,757694.7705838624,KES,Customer activity aligned with historical patterns; ID verified. #174f61,customer activity aligned with historical patterns id verified f
TXN004748,Eldoret,CL369,Retail,2023-04-11,325207.0472336496,KES,Customer activity aligned with historical patterns; ID verified. #176b06,customer activity aligned with historical patterns id verified b
TXN003614,Westlands,CL118,SME,2023-09-12,969949.249562794,KES,"969,949. KES amount Approx verified. ID Nairobi; at processed repayment loan for Transaction #38ee81",kes amount approx verified id nairobi at processed repayment loan for transaction ee
TXN003827,Westlands,CL257,Retail,2022-11-13,3074965.5852701017,KES,"High-value tranfer to UK; third-party deposits observed; escalate to compliance team. Approx amount KES 3,074,966. #88d439",high value tranfer to uk third party deposits observed escalate to compliance team approx amount kes d
TXN000381,Eldoret,CL316,Retail,2024-12-07,1156081.2591199789,KES,triggered. EDD KYC; valid no detected; pattern Irregular #2b8854,triggered edd kyc valid no detected pattern irregular b
TXN003066,Nairobi_Main,CL667,Retail,2022-01-24,9620817.175212547,KES,"Large foreign remittance to Mauritius; third-party deposits observed; escalate to compliance team. Approx amount KES 9,620,817. #f620dc",large foreign remittance to mauritius third party deposits observed escalate to compliance team approx amount kes f dc
TXN003711,Eldoret,CL290,Retail,2022-08-26,237739.0514112401,KES,reviewed. statements Nakuru; at payment bill or salary Processed #e8caa2,reviewed statements nakuru at payment bill or salary processed e caa
TXN001034,Nairobi_Main,CL727,Retail,2022-04-26,425818.9250798101,KES,Routine payment for loan repayment at Nairobi; ID verified. #42552d,routine payment for loan repayment at nairobi id verified d
TXN001208,Eldoret,CL399,Retail,2023-04-19,561100.467756279,KES,"561,100. KES amount Approx team. compliance to escalate transactions; with inconsistent profile Dubai; to transfer High-value #0f9bfd",kes amount approx team compliance to escalate transactions with inconsistent profile dubai to transfer high value f bfd
TXN000261,Eldoret,CL723,SME,2023-09-04,1879332.426661014,KES,"Unusual outgoing activity; third-party deposits observed; escalate to compliance team. Approx amount KES 1,879,332. #e910b8",unusual outgoing activity third party deposits observed escalate to compliance team approx amount kes e b
TXN002810,Eldoret,CL407,Corporate,2024-01-04,1784967.3394190993,KES,Irregular pattern detected; profile inconsistent with transactions; escalate to compliance team. #05521f,irregular pattern detected profile inconsistent with transactions escalate to compliance team f
TXN000435,Eldoret,CL941,Retail,2024-10-12,628987.3010026787,KES,"Customer activity aligned with historical patterns; invoice checked. Approx amount KES 628,987. #7934ca",customer activity aligned with historical patterns invoice checked approx amount kes ca
TXN000672,Nairobi_Main,CL830,Corporate,2023-01-14,1456549.9732937228,KES,High-value transfer to China; structuring suspected; EDD triggered. #23672d,high value transfer to china structuring suspected edd triggered d
TXN003327,Mombasa,CL391,SME,2023-07-23,1166659.9882168882,KES,Irregular pattern detected; third-party deposits observed; escalate to compliance team. #004c52,irregular pattern detected third party deposits observed escalate to compliance team c
TXN003726,Mombasa,CL913,Retail,2024-04-10,3100848.158211176,KES,"3,100,848. KES amount Approx team. compliance to escalate transactions; with inconsistent profile Kong; Hong to tranfer High-value #11c224",kes amount approx team compliance to escalate transactions with inconsistent profile kong hong to tranfer high value c
TXN003474,Nairobi_Main,CL137,Corporate,2024-05-05,361525.8029939941,KES,Customer activity aligned with historical patterns; ID verified. #4dad65,customer activity aligned with historical patterns id verified dad
TXN004907,Westlands,CL446,Corporate,2023-07-31,702118.0397141775,KES,Irregular pattern detected; third-party deposits observed; STR recommended. #ab8ee3,irregular pattern detected third party deposits observed str recommended ab ee
TXN000682,Kisumu,CL154,Corporate,2024-01-29,1236668.6631833797,KES,"Unusual outgoing activity; structuring suspected; EDD triggered. Approx amount KES 1,236,669. #340fbc",unusual outgoing activity structuring suspected edd triggered approx amount kes fbc
TXN003981,Eldoret,CL305,Corporate,2022-09-18,8680182.459883092,KES,"Large foreign remittance to Mauritius; profile inconsistent with transactions; EDD triggered. Approx amount KES 8,680,182. #189431",large foreign remittance to mauritius profile inconsistent with transactions edd triggered approx amount kes
