transaction_id,branch,client_id,client_type,transaction_date,amount,currency,narrative,clean_narrative
TXN003847,Eldoret,CL595,Retail,2023-09-18,431896.9692100545,KES,Processed salary or bill payment at Mombasa; statements reviewed. #00b082,processed salary or bill payment at mombasa statements reviewed b
TXN003288,Mombasa,CL865,Retail,2023-03-17,384841.2789276766,KES,"384,841. KES amount Approx checked. invoice patterns; historical with aligned activity Customer #ea9b6b",kes amount approx checked invoice patterns historical with aligned activity customer ea b b
TXN003721,Mombasa,CL205,SME,2022-03-27,1967394.874697195,KES,reviewed. statements Nairobi; at payment bill or salary Processed #482be9,reviewed statements nairobi at payment bill or salary processed be
TXN000846,Nairobi_Main,CL862,Retail,2022-06-02,731182.2697946804,KES,Processed salary or bill payment at Kisumu; ID verified. #e05540,processed salary or bill payment at kisumu id verified e
TXN002670,Eldoret,CL638,Corporate,2022-04-27,366685.4690816346,KES,"Processed salary or bill payment at Nairobi; invoice checked. Approx amount KES 366,685. #8bc73f",processed salary or bill payment at nairobi invoice checked approx amount kes bc f
TXN001343,Nairobi_Main,CL627,Retail,2024-03-22,5789645.649865511,KES,triggered. EDD suspected; structuring detected; pattern Irregular #993eab,triggered edd suspected structuring detected pattern irregular eab
TXN004249,Eldoret,CL687,Corporate,2023-04-25,1882731.154390921,KES,"Large foreign remittance to China; no valid KYC; STR recommended. Approx amount KES 1,882,731. #aeadd5",large foreign remittance to china no valid kyc str recommended approx amount kes aeadd
TXN004818,Nairobi_Main,CL619,SME,2023-03-13,926643.696084343,KES,"Customer activity aligned with historical patterns; ID verified. Approx amount KES 926,644. #86be46",customer activity aligned with historical patterns id verified approx amount kes be
TXN001168,Westlands,CL523,Retail,2023-08-12,905577.4080382998,KES,"Routine payment for salary at Nakuru; invoice checked. Approx amount KES 905,577. #eb4755",routine payment for salary at nakuru invoice checked approx amount kes eb
TXN000080,Westlands,CL975,SME,2022-07-23,512076.6902829349,KES,Transaction for utilities processed at Thika; invoice checked. #386fd5,transaction for utilities processed at thika invoice checked fd
TXN003282,Westlands,CL260,Retail,2024-08-21,132366.71833234388,KES,"Routine payment for salary at Kisumu; ID verified. Approx amount KES 132,367. #ef8374",routine payment for salary at kisumu id verified approx amount kes ef
TXN001625,Kisumu,CL896,Retail,2023-06-16,1271914.2994933096,KES,Transaction for rent processed at Thika; statements reviewed. #530e10,transaction for rent processed at thika statements reviewed e
TXN004549,Westlands,CL604,SME,2024-09-13,1610471.3696466188,KES,"Irregular pattern detected; third-party deposits observed; escalate to compliance team. Approx amount KES 1,610,471. #5af2a9",irregular pattern detected third party deposits observed escalate to compliance team approx amount kes af a
TXN000380,Nairobi_Main,CL215,Corporate,2022-04-22,331769.1618624324,KES,"Processed salary or bill payment at Mombasa; invoice checked. Approx amount KES 331,769. #744ac5",processed salary or bill payment at mombasa invoice checked approx amount kes ac
TXN002707,Westlands,CL716,Retail,2023-12-24,2025875.9622828297,KES,triggered. EDD transactions; with inconsistent profile UK; to remittance foreign Large #ebe9e4,triggered edd transactions with inconsistent profile uk to remittance foreign large ebe e
TXN002922,Westlands,CL968,SME,2022-03-12,521107.63511986623,KES,reviewed. statements Mombasa; at processed rent for Transaction #5e5c86,reviewed statements mombasa at processed rent for transaction e c
TXN004434,Kisumu,CL356,Retail,2023-11-26,405484.17592368944,KES,"405,484. KES amount Approx checked. invoice Thika; at processed salary for Transaction #503430",kes amount approx checked invoice thika at processed salary for transaction
TXN002704,Nairobi_Main,CL192,Retail,2022-09-26,2481509.831891031,KES,Large foreign remittance to Dubai; third-party deposits observed; escalate to compliance team. #10f9ee,large foreign remittance to dubai third party deposits observed escalate to compliance team f ee
TXN000397,Nairobi_Main,CL193,Retail,2024-07-09,6705811.770187945,KES,"Unusual outgoing activity; structuring suspected; EDD triggered. Approx amount KES 6,705,812. #8b5580",unusual outgoing activity structuring suspected edd triggered approx amount kes b
TXN004603,Westlands,CL192,Corporate,2022-05-21,6456023.341151575,KES,"Irregular pattern detected; no valid KYC; escalate to compliance team. Approx amount KES 6,456,023. #239ebb",irregular pattern detected no valid kyc escalate to compliance team approx amount kes ebb
TXN000335,Kisumu,CL354,SME,2022-07-10,1736962.3273534705,KES,High-value transfer to Cyprus; structuring suspected; escalate to compliance team. #3d5e34,high value transfer to cyprus structuring suspected escalate to compliance team d e
TXN000624,Kisumu,CL500,Corporate,2022-12-25,8317464.04436269,KES,"8,317,464. KES amount Approx team. compliance to escalate observed; deposits third-party activity; outgoing Unusual #db7f0e",kes amount approx team compliance to escalate observed deposits third party activity outgoing unusual db f e
TXN004665,Westlands,CL192,SME,2024-09-27,534762.0238783987,KES,"Processed salary or bill payment at Thika; statements reviewed. Approx amount KES 534,762. #28aa12",processed salary or bill payment at thika statements reviewed approx amount kes aa
TXN002526,Mombasa,CL136,Corporate,2024-11-26,801360.4648134919,KES,Customer activity aligned with historical patterns; invoice checked. #56c404,customer activity aligned with historical patterns invoice checked c
TXN001657,Kisumu,CL189,SME,2022-12-25,6490419.873532495,KES,recommended. STR transactions; with inconsistent profile activity; outgoing Unusual #142d3b,recommended str transactions with inconsistent profile activity outgoing unusual d b
TXN003040,Westlands,CL582,Retail,2022-11-06,3433856.572338361,KES,Large foreign remittance to Cyprus; no valid KYC; escalate to compliance team. #625cbd,large foreign remittance to cyprus no valid kyc escalate to compliance team cbd
TXN001041,Mombasa,CL574,SME,2024-07-15,433124.7258603046,KES,"Customer activity aligned with historical patterns; ID verified. Approx amount KES 433,125. #ea885b",customer activity aligned with historical patterns id verified approx amount kes ea b
TXN001059,Kisumu,CL621,Retail,2024-03-24,460731.1520280467,KES,"Transaction for school fees processed at Thika; ID verified. Approx amount KES 460,731. #8afefc",transaction for school fees processed at thika id verified approx amount kes afefc
TXN002991,Kisumu,CL868,Retail,2023-11-25,910257.517091322,KES,"Routine payment for salary at Thika; statements reviewed. Approx amount KES 910,258. #3a5be2",routine payment for salary at thika statements reviewed approx amount kes a be
TXN000771,Mombasa,CL376,Corporate,2022-12-15,402831.3459263288,KES,"Transaction for rent processed at Nairobi; ID verified. Approx amount KES 402,831. #1844a1",transaction for rent processed at nairobi id verified approx amount kes a
TXN001254,Eldoret,CL432,Retail,2023-10-19,5985809.204266198,KES,"High-value transfer to China; third-party deposits observed; EDD triggered. Approx amount KES 5,985,809. #d40890",high value transfer to china third party deposits observed edd triggered approx amount kes d
TXN000791,Mombasa,CL463,Retail,2024-03-02,690645.1094459809,KES,verified. ID patterns; historical with aligned activity Customer #170a71,verified id patterns historical with aligned activity customer a
TXN003183,Westlands,CL942,Corporate,2024-10-16,473755.9255087374,KES,"Routine payment for salary at Thika; ID verified. Approx amount KES 473,756. #3844d6",routine payment for salary at thika id verified approx amount kes d
TXN000454,Eldoret,CL485,Retail,2022-02-02,1230299.4382655015,KES,"1,230,299. KES amount Approx team. compliance to escalate suspected; structuring detected; pattern Irregular #db1ede",kes amount approx team compliance to escalate suspected structuring detected pattern irregular db ede
TXN001130,Kisumu,CL158,SME,2024-04-11,747844.2780179156,KES,"747,844. KES amount Approx checked. invoice Thika; at payment bill or salary Processed #89a109",kes amount approx checked invoice thika at payment bill or salary processed a
TXN004072,Eldoret,CL725,Corporate,2024-10-22,496914.7112430549,KES,Unusual outgoing activity; structuring suspected; STR recommended. #7ae422,unusual outgoing activity structuring suspected str recommended ae
TXN002274,Nairobi_Main,CL391,Corporate,2024-07-11,745252.7153107711,KES,"Irregular pattern detected; third-party deposits observed; EDD triggered. Approx amount KES 745,253. #bb8793",irregular pattern detected third party deposits observed edd triggered approx amount kes bb
TXN004288,Eldoret,CL552,SME,2022-07-11,7711458.611860453,KES,Unusual outgoing activity; structuring suspected; EDD triggered. #8874af,unusual outgoing activity structuring suspected edd triggered af
TXN002214,Nairobi_Main,CL566,SME,2022-01-09,429754.9736644495,KES,"429,755. KES amount Approx reviewed. statements Kisumu; at repayment loan for payment Routine #7ea26d",kes amount approx reviewed statements kisumu at repayment loan for payment routine ea d
TXN000696,Eldoret,CL744,Corporate,2022-11-01,750348.5535106903,KES,reviewed. statements Nakuru; at payment bill or salary Processed #18e7c4,reviewed statements nakuru at payment bill or salary processed e c
TXN003795,Mombasa,CL240,SME,2024-08-23,1479108.4314958558,KES,Large foreign remittance to Mauritius; no valid KYC; STR recommended. #f265f2,large foreign remittance to mauritius no valid kyc str recommended f f
TXN000627,Mombasa,CL976,Retail,2024-03-23,546860.573538226,KES,verified. ID Thika; at fees school for payment Routine #1119c8,verified id thika at fees school for payment routine c
TXN001046,Nairobi_Main,CL118,SME,2024-01-28,942815.617465482,KES,Customer activity aligned with historical patterns; invoice checked. #9273e9,customer activity aligned with historical patterns invoice checked e
TXN000709,Eldoret,CL744,SME,2022-11-15,1958167.1336529984,KES,Transaction for utilities processed at Kisumu; statements reviewed. #774316,transaction for utilities processed at kisumu statements reviewed
TXN001491,Mombasa,CL928,Retail,2023-01-02,3579520.81896732,KES,reviewed. statements Nairobi; at payment bill or salary Processed #f40f18,reviewed statements nairobi at payment bill or salary processed f f
TXN001829,Eldoret,CL771,Retail,2024-08-03,605127.6678927199,KES,Transaction for utilities processed at Nairobi; invoice checked. #bbb579,transaction for utilities processed at nairobi invoice checked bbb
TXN000047,Kisumu,CL129,SME,2023-10-28,1251665.4198082476,KES,"Routine payment for rent at Mombasa; ID verified. Approx amount KES 1,251,665. #d3f642",routine payment for rent at mombasa id verified approx amount kes d f
TXN001619,Mombasa,CL579,Retail,2022-03-17,1334292.8331032873,KES,Transaction for school fees processed at Kisumu; invoice checked. #cd14f4,transaction for school fees processed at kisumu invoice checked cd f
TXN000022,Nairobi_Main,CL999,Retail,2023-06-26,2106999.34984902,KES,Unusual outgoing activity; profile inconsistent with transactions; escalate to compliance team. #394b6a,unusual outgoing activity profile inconsistent with transactions escalate to compliance team b a
TXN003277,Mombasa,CL194,SME,2023-12-13,656060.0137215726,KES,"656,060. KES amount Approx verified. ID patterns; historical with aligned activity Customer #d3f159",kes amount approx verified id patterns historical with aligned activity customer d f
TXN001326,Nairobi_Main,CL459,Retail,2022-05-25,851366.6370010527,KES,Irregular pattern detected; structuring suspected; STR recommended. #b475ce,irregular pattern detected structuring suspected str recommended b ce
TXN003844,Kisumu,CL970,Retail,2024-06-03,1841602.3610511413,KES,Processed salary or bill payment at Mombasa; statements reviewed. #8e7b3e,processed salary or bill payment at mombasa statements reviewed e b e
TXN004496,Kisumu,CL194,SME,2024-01-07,339890.83577229857,KES,Transaction for school fees processed at Mombasa; ID verified. #e6f1bf,transaction for school fees processed at mombasa id verified e f bf
TXN002199,Eldoret,CL230,SME,2024-12-15,840296.9324849389,KES,checked. invoice Nairobi; at processed rent for Transaction #91d5b5,checked invoice nairobi at processed rent for transaction d b
TXN003239,Nairobi_Main,CL286,SME,2023-09-24,1151459.557744003,KES,reviewed. statements Mombasa; at processed utilities for Transaction #6547ab,reviewed statements mombasa at processed utilities for transaction ab
TXN001009,Westlands,CL188,Corporate,2024-10-16,410583.8096798719,KES,"Processed salary or bill payment at Thika; invoice checked. Approx amount KES 410,584. #9614ff",processed salary or bill payment at thika invoice checked approx amount kes ff
TXN001167,Westlands,CL601,SME,2023-07-15,886234.0717563855,KES,"Routine payment for utilities at Mombasa; statements reviewed. Approx amount KES 886,234. #7e2917",routine payment for utilities at mombasa statements reviewed approx amount kes e
TXN004200,Westlands,CL493,SME,2023-06-28,708255.410270978,KES,verified. ID Nairobi; at processed salary for Transaction #c3649a,verified id nairobi at processed salary for transaction c a
TXN002699,Westlands,CL521,Corporate,2024-07-25,6556975.400386037,KES,Unusual outgoing activity; profile inconsistent with transactions; STR recommended. #b725a8,unusual outgoing activity profile inconsistent with transactions str recommended b a
TXN003587,Kisumu,CL548,Retail,2023-11-11,314051.1380331721,KES,Routine payment for rent at Mombasa; invoice checked. #402561,routine payment for rent at mombasa invoice checked
TXN004592,Mombasa,CL290,Retail,2023-07-17,875062.594605084,KES,"Routine payment for school fees at Nakuru; ID verified. Approx amount KES 875,063. #5a5d3f",routine payment for school fees at nakuru id verified approx amount kes a d f
TXN004922,Nairobi_Main,CL857,SME,2023-03-04,3364037.7770925784,KES,Large foreign remittance to Cyprus; third-party deposits observed; EDD triggered. #4ea952,large foreign remittance to cyprus third party deposits observed edd triggered ea
TXN003899,Westlands,CL182,Corporate,2023-11-29,778985.5333388007,KES,"Routine payment for school fees at Thika; ID verified. Approx amount KES 778,986. #93670b",routine payment for school fees at thika id verified approx amount kes b
TXN004449,Kisumu,CL103,SME,2022-09-14,7625735.743101677,KES,High-value transfer to UK; profile inconsistent with transactions; escalate to compliance team. #53c6bb,high value transfer to uk profile inconsistent with transactions escalate to compliance team c bb
TXN002777,Mombasa,CL272,SME,2023-02-26,504312.6983459396,KES,"Transaction for loan repayment processed at Nairobi; ID verified. Approx amount KES 504,313. #6f116b",transaction for loan repayment processed at nairobi id verified approx amount kes f b
TXN001372,Eldoret,CL912,Corporate,2024-11-20,228586.32318089853,KES,"Processed salary or bill payment at Mombasa; statements reviewed. Approx amount KES 228,586. #d2b286",processed salary or bill payment at mombasa statements reviewed approx amount kes d b
TXN001079,Mombasa,CL805,Corporate,2023-12-20,1082902.2024724549,KES,"Processed salary or bill payment at Kisumu; ID verified. Approx amount KES 1,082,902. #ae242d",processed salary or bill payment at kisumu id verified approx amount kes ae d
TXN000339,Westlands,CL568,Retail,2024-11-27,402476.83163840097,KES,Customer activity aligned with historical patterns; invoice checked. #ce9bc3,customer activity aligned with historical patterns invoice checked ce bc
TXN004111,Nairobi_Main,CL277,Retail,2024-06-17,346569.952588217,KES,verified. ID Nairobi; at payment bill or salary Processed #067699,verified id nairobi at payment bill or salary processed
TXN003753,Kisumu,CL181,Retail,2022-01-15,436368.6831608851,KES,Routine payment for school fees at Kisumu; statements reviewed. #889b36,routine payment for school fees at kisumu statements reviewed b
TXN002298,Eldoret,CL100,Retail,2024-08-18,941580.4430271246,KES,"941,580. KES amount Approx checked. invoice Kisumu; at payment bill or salary Processed #b31c65",kes amount approx checked invoice kisumu at payment bill or salary processed b c
TXN001121,Eldoret,CL588,Retail,2024-09-08,5770834.61307706,KES,High-value transfer to Mauritius; third-party deposits observed; EDD triggered. #368e61,high value transfer to mauritius third party deposits observed edd triggered e
TXN002751,Westlands,CL427,Retail,2023-11-14,1796074.1400620218,KES,Transaction for salary processed at Nakuru; invoice checked. #692426,transaction for salary processed at nakuru invoice checked
TXN004556,Kisumu,CL886,Retail,2022-05-28,802076.0933843488,KES,"802,076. KES amount Approx team. compliance to escalate KYC; valid no activity; outgoing Unusual #c95696",kes amount approx team compliance to escalate kyc valid no activity outgoing unusual c
TXN004340,Westlands,CL466,SME,2024-11-12,1154095.3017671197,KES,verified. ID patterns; historical with aligned activity Customer #8b1616,verified id patterns historical with aligned activity customer b
TXN000104,Westlands,CL458,SME,2024-03-13,533438.9988883453,KES,Processed salary or bill payment at Kisumu; statements reviewed. #53757a,processed salary or bill payment at kisumu statements reviewed a
TXN003657,Westlands,CL211,Corporate,2023-01-11,138616.39366300707,KES,Transaction for utilities processed at Mombasa; ID verified. #f59229,transaction for utilities processed at mombasa id verified f
TXN001102,Kisumu,CL739,Corporate,2023-07-22,12988010.677410392,KES,team. compliance to escalate KYC; valid no Kong; Hong to remittance foreign Large #7b4a2e,team compliance to escalate kyc valid no kong hong to remittance foreign large b a e
TXN001231,Eldoret,CL168,SME,2022-02-16,577912.249340382,KES,High-value tranfer to UK; third-party deposits observed; escalate to compliance team. #ed9258,high value tranfer to uk third party deposits observed escalate to compliance team ed
TXN003374,Kisumu,CL639,SME,2023-06-17,183898.43750428004,KES,"Routine payment for loan repayment at Thika; ID verified. Approx amount KES 183,898. #830a1c",routine payment for loan repayment at thika id verified approx amount kes a c
TXN004664,Eldoret,CL205,Retail,2023-10-21,987460.916187786,KES,"Transaction for salary processed at Nairobi; statements reviewed. Approx amount KES 987,461. #8cc487",transaction for salary processed at nairobi statements reviewed approx amount kes cc
TXN002024,Mombasa,CL538,Corporate,2022-12-20,130932.74321379849,KES,High-value transfer to Hong Kong; profile inconsistent with transactions; STR recommended. #24abb5,high value transfer to hong kong profile inconsistent with transactions str recommended abb
TXN004217,Mombasa,CL548,Corporate,2023-04-24,426242.5460842422,KES,checked. invoice Nakuru; at payment bill or salary Processed #b595d0,checked invoice nakuru at payment bill or salary processed b d
TXN003037,Kisumu,CL103,Retail,2024-06-10,672881.5833297385,KES,Processed salary or bill payment at Nairobi; statements reviewed. #232f68,processed salary or bill payment at nairobi statements reviewed f
TXN001122,Nairobi_Main,CL621,Retail,2024-12-03,3523118.876843274,KES,"Large foreign remittance to Hong Kong; profile inconsistent with transactions; escalate to compliance team. Approx amount KES 3,523,119. #2207bc",large foreign remittance to hong kong profile inconsistent with transactions escalate to compliance team approx amount kes bc
TXN002584,Kisumu,CL559,SME,2023-03-07,1286619.0748980609,KES,"Processed salary or bill payment at Thika; statements reviewed. Approx amount KES 1,286,619. #babf15",processed salary or bill payment at thika statements reviewed approx amount kes babf
TXN002816,Mombasa,CL453,SME,2023-01-02,3059799.823408029,KES,Unusual outgoing activity; structuring suspected; escalate to compliance team. #0ef28f,unusual outgoing activity structuring suspected escalate to compliance team ef f
TXN000862,Nairobi_Main,CL197,Corporate,2022-12-13,1764280.7195083543,KES,"Transaction for utilities processed at Mombasa; invoice checked. Approx amount KES 1,764,281. #d615f8",transaction for utilities processed at mombasa invoice checked approx amount kes d f
TXN001900,Kisumu,CL361,Corporate,2022-05-20,972736.0822948144,KES,Transaction for loan repayment processed at Nairobi; ID verified. #a4acf6,transaction for loan repayment processed at nairobi id verified a acf
TXN000987,Westlands,CL429,Corporate,2023-05-21,1103672.268387069,KES,Routine payment for utilities at Kisumu; invoice checked. #47b5b3,routine payment for utilities at kisumu invoice checked b b
TXN002846,Nairobi_Main,CL873,SME,2024-11-25,395455.372357357,KES,Transaction for loan repayment processed at Kisumu; invoice checked. #6fabc8,transaction for loan repayment processed at kisumu invoice checked fabc
TXN000972,Mombasa,CL405,Retail,2024-07-19,1075665.9157721233,KES,"Routine payment for rent at Nairobi; statements reviewed. Approx amount KES 1,075,666. #628d1c",routine payment for rent at nairobi statements reviewed approx amount kes d c
TXN003155,Kisumu,CL202,Corporate,2023-10-11,456731.86366023874,KES,"Unusual outgoing activity; structuring suspected; escalate to compliance team. Approx amount KES 456,732. #57ca09",unusual outgoing activity structuring suspected escalate to compliance team approx amount kes ca
TXN004178,Eldoret,CL386,SME,2023-12-13,2125218.9470965173,KES,"Transaction for school fees processed at Kisumu; invoice checked. Approx amount KES 2,125,219. #d84382",transaction for school fees processed at kisumu invoice checked approx amount kes d
TXN002401,Nairobi_Main,CL588,SME,2024-02-29,675882.5589020648,KES,Transaction for rent processed at Nakuru; ID verified. #563b57,transaction for rent processed at nakuru id verified b
TXN004788,Mombasa,CL486,Corporate,2022-03-07,302164.66346640827,KES,Unusual outgoing activity; no valid KYC; STR recommended. #b0df58,unusual outgoing activity no valid kyc str recommended b df
TXN002077,Kisumu,CL214,Corporate,2024-04-05,1387090.7220891933,KES,Routine payment for school fees at Kisumu; statements reviewed. #e26181,routine payment for school fees at kisumu statements reviewed e
TXN000438,Kisumu,CL964,SME,2023-07-13,181249.9492018799,KES,Transaction for rent processed at Nakuru; invoice checked. #27553b,transaction for rent processed at nakuru invoice checked b
TXN004768,Westlands,CL708,SME,2023-01-26,1227621.5678214454,KES,checked. invoice patterns; historical with aligned activity Customer #c2b815,checked invoice patterns historical with aligned activity customer c b
TXN003484,Westlands,CL751,SME,2024-09-09,798477.1276358655,KES,"Irregular pattern detected; no valid KYC; EDD triggered. Approx amount KES 798,477. #903635",irregular pattern detected no valid kyc edd triggered approx amount kes
TXN004488,Nairobi_Main,CL859,SME,2022-10-18,1106599.883943354,KES,"1,106,600. KES amount Approx checked. invoice Kisumu; at payment bill or salary Processed #a74cca",kes amount approx checked invoice kisumu at payment bill or salary processed a cca
TXN000730,Eldoret,CL299,SME,2024-03-11,684943.5318345625,KES,"Processed salary or bill payment at Nairobi; invoice checked. Approx amount KES 684,944. #f13dce",processed salary or bill payment at nairobi invoice checked approx amount kes f dce
TXN001251,Westlands,CL799,Corporate,2023-07-06,4198240.493874572,KES,"Unusual outgoing activity; third-party deposits observed; STR recommended. Approx amount KES 4,198,240. #6356c9",unusual outgoing activity third party deposits observed str recommended approx amount kes c
TXN004365,Kisumu,CL289,SME,2024-06-19,2593600.278628268,KES,Processed salary or bill payment at Thika; invoice checked. #dcebcc,processed salary or bill payment at thika invoice checked dcebcc
TXN003123,Nairobi_Main,CL415,Retail,2022-08-11,464807.87826746673,KES,reviewed. statements Mombasa; at payment bill or salary Processed #ab0a4d,reviewed statements mombasa at payment bill or salary processed ab a d
TXN002121,Eldoret,CL566,SME,2023-07-20,1034287.1480363522,KES,"1,034,287. KES amount Approx verified. ID Nakuru; at fees school for payment Routine #f4d481",kes amount approx verified id nakuru at fees school for payment routine f d
TXN000652,Nairobi_Main,CL109,Retail,2023-06-29,494735.1840162296,KES,"Customer activity aligned with historical patterns; ID verified. Approx amount KES 494,735. #ac50db",customer activity aligned with historical patterns id verified approx amount kes ac db
TXN004463,Mombasa,CL311,Retail,2023-06-23,1347803.7910705365,KES,Routine payment for loan repayment at Thika; statements reviewed. #c3720a,routine payment for loan repayment at thika statements reviewed c a
TXN001074,Westlands,CL800,Corporate,2023-11-17,4860442.968487274,KES,"4,860,443. KES amount Approx team. compliance to escalate KYC; valid no activity; outgoing Unusual #091203",kes amount approx team compliance to escalate kyc valid no activity outgoing unusual
TXN002125,Kisumu,CL520,Corporate,2024-07-14,875879.1297164033,KES,Routine payment for loan repayment at Nakuru; ID verified. #3344d0,routine payment for loan repayment at nakuru id verified d
TXN003905,Kisumu,CL953,Corporate,2023-09-22,1483885.6744435406,KES,team. compliance to escalate observed; deposits third-party Kong; Hong to transfer High-value #fc8c0a,team compliance to escalate observed deposits third party kong hong to transfer high value fc c a
TXN004645,Nairobi_Main,CL422,SME,2022-08-04,1851321.0622267544,KES,Customer activity aligned with historical patterns; invoice checked. #e38981,customer activity aligned with historical patterns invoice checked e
